{
  "$schema": "../page.schema.json",
  "layout": "default",
  "title": "From a first idea to a shared experience · Encore",
  "description": "Encore page design prototype. Editorial copy is a draft for review.",
  "bodyClass": "",
  "bodyStyle": "",
  "mainId": "main",
  "stylesheets": [
    "https://fonts.googleapis.com/css2?family=Open+Sans:wght@400;500;600;700;800&display=swap",
    "assets/css/site-pages.css",
    "assets/css/pages/editorial.css"
  ],
  "scripts": [
    "assets/js/partials/site-pages.js"
  ],
  "sections": [
    {
      "component": "headers/split",
      "data": {
        "eyebrow": "Creative & Content",
        "title": "From a first idea to a shared experience",
        "accent": "",
        "description": "Every event begins with a question: what should people feel, understand or do differently when they leave?",
        "ctaLabel": "Read the story",
        "ctaHref": "#article-story",
        "image": "assets/img/client-updates/twobytwo_Adobe_Summit_2023-164.jpg",
        "imageAlt": "Large event stage with colourful Adobe Summit screen content",
        "focalPoint": "center center",
        "colour": "#d454b9",
        "caption": "Design prototype · Draft editorial copy for review.",
        "backHref": "news.html",
        "backLabel": "All news",
        "video": "",
        "breadcrumb": {
          "parents": [
            {
              "href": "news.html",
              "label": "News"
            }
          ],
          "current": "From a first idea to a shared experience"
        }
      }
    },
    {
      "component": "pages/news-creative-process/start-with-the-audience",
      "data": {}
    },
    {
      "component": "sections/editorial-cta",
      "data": {}
    }
  ]
}
