{
  "$schema": "../page.schema.json",
  "layout": "default",
  "title": "Component library \u00b7 Encore",
  "description": "Shared components, interaction examples and the automatically generated Encore design inventory.",
  "bodyClass": "",
  "bodyStyle": "",
  "mainId": "main-content",
  "stylesheets": [
    "https://fonts.googleapis.com/css2?family=Open+Sans:wght@400;500;600;700&display=swap",
    "assets/css/site-pages.css",
    "assets/css/pages/component-library.css"
  ],
  "scripts": ["assets/js/partials/site-pages.js"],
  "sections": [
    {
      "component": "sections/component-library",
      "data": {}
    }
  ]
}
