{
  "$schema": "../page.schema.json",
  "layout": "default",
  "title": "The planning behind a seamless show · Encore",
  "description": "Encore page design prototype. Editorial copy is a draft for review.",
  "bodyClass": "",
  "bodyStyle": "",
  "mainId": "main",
  "stylesheets": [
    "https://fonts.googleapis.com/css2?family=Open+Sans:wght@400;500;600;700;800&display=swap",
    "assets/css/site-pages.css",
    "assets/css/pages/editorial.css"
  ],
  "scripts": [
    "assets/js/partials/site-pages.js"
  ],
  "sections": [
    {
      "component": "headers/split",
      "data": {
        "eyebrow": "Technical Production",
        "title": "The planning behind a seamless show",
        "accent": "",
        "description": "A clear technical plan connects the creative ambition with everything needed to deliver it in the room.",
        "ctaLabel": "Read the story",
        "ctaHref": "#article-story",
        "image": "assets/img/client-updates/6Y8A3288_2.jpg",
        "imageAlt": "Performers on a stage with coordinated lighting and video",
        "focalPoint": "center center",
        "colour": "#d454b9",
        "caption": "Design prototype · Draft editorial copy for review.",
        "backHref": "news.html",
        "backLabel": "All news",
        "video": "",
        "breadcrumb": {
          "parents": [
            {
              "href": "news.html",
              "label": "News"
            }
          ],
          "current": "The planning behind a seamless show"
        }
      }
    },
    {
      "component": "pages/news-production-planning/bring-the-teams-together-early",
      "data": {}
    },
    {
      "component": "sections/editorial-cta",
      "data": {}
    }
  ]
}
