{
  "$schema": "../page.schema.json",
  "layout": "default",
  "title": "News & insights · Encore",
  "description": "Encore page design prototype. Editorial copy is a draft for review.",
  "bodyClass": "",
  "bodyStyle": "",
  "mainId": "main",
  "stylesheets": [
    "https://fonts.googleapis.com/css2?family=Open+Sans:wght@400;500;600;700;800&display=swap",
    "assets/css/site-pages.css",
    "assets/css/pages/editorial.css"
  ],
  "scripts": [
    "assets/js/partials/site-pages.js"
  ],
  "sections": [
    {
      "component": "headers/parallax",
      "data": {
        "eyebrow": "News & insights",
        "title": "Behind the",
        "accent": "experience.",
        "description": "Ideas, perspectives and a closer look at what goes into an unforgettable event.",
        "ctaLabel": "Explore the stories",
        "ctaHref": "#latest-stories",
        "image": "assets/video/ch3-poster.jpg",
        "imageAlt": "A presenter on stage under spotlights",
        "focalPoint": "center center",
        "colour": "#9276ff",
        "caption": "Perspectives on creativity, production and audience experience · Draft editorial copy.",
        "backHref": "",
        "backLabel": "",
        "video": "assets/video/ch3.mp4",
        "word": "Insight",
        "breadcrumb": {
          "parents": [],
          "current": "News"
        }
      }
    },
    {
      "component": "pages/news/story-grid",
      "data": {}
    },
    {
      "component": "sections/editorial-cta",
      "data": {}
    }
  ]
}
